{
  "$schema": "https://example.com/design-tokens.schema.json",
  "meta": {
    "generated": "2026-09-23T13:32:15.627Z",
    "version": "0.6.0",
    "source": [
      "src/tokens.ts",
      "src/spacing.ts",
      "src/shadows.ts"
    ],
    "deprecated": {
      "statusWarning": {
        "replaceWith": [
          "statusWarningBg",
          "statusWarningText"
        ],
        "rationale": "Use background + text pair for accessible warning states."
      },
      "statusSuccess": {
        "replaceWith": [
          "statusSuccessBg",
          "statusSuccessText"
        ],
        "rationale": "Adopt background/text pattern for consistency."
      },
      "statusDanger": {
        "replaceWith": [
          "statusDangerBg",
          "statusDangerText"
        ],
        "rationale": "Adopt background/text pattern for consistency."
      }
    }
  },
  "color": {
    "blue50": "#f5fbff",
    "blue100": "#ebf7ff",
    "blue200": "#d8f0ff",
    "blue250": "#ceecff",
    "blue300": "#bbe1ff",
    "blue400": "#95caff",
    "blue500": "#82baff",
    "blue600": "#5e9aff",
    "blue700": "#1f60ff",
    "blue750": "#0b4bff",
    "blue800": "#093fda",
    "blue900": "#082d9e",
    "blue950": "#06206e",
    "blue975": "#1a2759",
    "blue990": "#333f6b",
    "blue1000": "#000f47",
    "blue1100": "#002c77",
    "gold50": "#fffcf8",
    "gold100": "#fff8ed",
    "gold200": "#fff5e1",
    "gold250": "#fff2da",
    "gold300": "#ffeeca",
    "gold400": "#ffe3aa",
    "gold500": "#ffd98a",
    "gold600": "#ffcf53",
    "gold650": "#ffc937",
    "gold700": "#ffab14",
    "gold750": "#ffbf00",
    "gold800": "#f5a907",
    "gold850": "#eaa501",
    "gold900": "#e09015",
    "gold950": "#d58b02",
    "gold1000": "#cb7623",
    "green50": "#f8fcf7",
    "green100": "#f2faef",
    "green200": "#e5f5df",
    "green250": "#def2d7",
    "green300": "#ceeac9",
    "green400": "#addbae",
    "green500": "#b0dc92",
    "green600": "#7cc664",
    "green700": "#6cc044",
    "green750": "#64bc30",
    "green800": "#54a731",
    "green900": "#449631",
    "green950": "#3a8a32",
    "green1000": "#2f7d32",
    "red50": "#fffafa",
    "red100": "#fff4f4",
    "red200": "#ffeded",
    "red250": "#ffe8e8",
    "red300": "#ffcfcf",
    "red400": "#ff9d9d",
    "red500": "#ff6b6b",
    "red600": "#f55555",
    "red700": "#ec4540",
    "red750": "#e53935",
    "red800": "#d33330",
    "red900": "#af2625",
    "red950": "#9d201f",
    "red1000": "#8b1a1a",
    "purple50": "#fef8fe",
    "purple100": "#fcf1fc",
    "purple200": "#f7ebfe",
    "purple250": "#f2e6ff",
    "purple300": "#e9d3ff",
    "purple400": "#dcbaff",
    "purple500": "#deb1ff",
    "purple600": "#b96bf5",
    "purple700": "#ab5aea",
    "purple750": "#8f20de",
    "purple800": "#842daf",
    "purple900": "#7720b0",
    "purple950": "#6a18a3",
    "purple1000": "#5e0f95",
    "gray50": "#fdfefe",
    "gray100": "#fbfbfb",
    "gray150": "#faf7f4",
    "gray200": "#f9f9f9",
    "gray250": "#f7f8f8",
    "gray300": "#eaebea",
    "gray350": "#dedbd6",
    "gray400": "#cfd0cd",
    "gray450": "#c5c2bd",
    "gray500": "#b4b6b1",
    "gray550": "#adaaa5",
    "gray600": "#9c9e9a",
    "gray650": "#94918c",
    "gray700": "#8a8c88",
    "gray750": "#787b78",
    "gray800": "#6a6e6b",
    "gray850": "#62615c",
    "gray900": "#4d5551",
    "gray950": "#3e4944",
    "gray1000": "#303c37",
    "neutral50": "#f8f8f8",
    "neutral100": "#eeeeee",
    "neutral200": "#e3e3e3",
    "neutral250": "#dadada",
    "neutral300": "#c4c4c4",
    "neutral400": "#a8a8a8",
    "neutral500": "#878787",
    "neutral600": "#767676",
    "neutral700": "#595959",
    "neutral750": "#4a4a4a",
    "neutral800": "#3b3b3b",
    "neutral900": "#252525",
    "neutral950": "#101010",
    "neutral1000": "#000000",
    "white": "#ffffff",
    "black": "#000000",
    "statusCritical": "#c53532",
    "statusWarning": "#cb7e03",
    "statusSuccess": "#14853d",
    "statusInfo": "#6fb4ff",
    "focusCyan": "#009de0",
    "focusBlue": "#3d7aff",
    "focusBlueDark": "#5e9aff",
    "shadesWhite90": "rgba(255,255,255,0.90)",
    "shadesWhite85": "rgba(255,255,255,0.85)",
    "shadesWhite80": "rgba(255,255,255,0.80)",
    "shadesWhite70": "rgba(255,255,255,0.70)",
    "shadesWhite65": "rgba(255,255,255,0.65)",
    "shadesWhite60": "rgba(255,255,255,0.60)",
    "shadesWhite50": "rgba(255,255,255,0.50)",
    "shadesWhite40": "rgba(255,255,255,0.40)",
    "shadesWhite30": "rgba(255,255,255,0.30)",
    "shadesWhite20": "rgba(255,255,255,0.20)",
    "shadesWhite10": "rgba(255,255,255,0.10)",
    "shadesWhite5": "rgba(255,255,255,0.05)",
    "shadesWhite0": "rgba(255,255,255,0.00)",
    "shadesBlack90": "rgba(0,0,0,0.90)",
    "shadesBlack85": "rgba(0,0,0,0.85)",
    "shadesBlack80": "rgba(0,0,0,0.80)",
    "shadesBlack75": "rgba(0,0,0,0.75)",
    "shadesBlack70": "rgba(0,0,0,0.70)",
    "shadesBlack65": "rgba(0,0,0,0.65)",
    "shadesBlack60": "rgba(0,0,0,0.60)",
    "shadesBlack55": "rgba(0,0,0,0.55)",
    "shadesBlack50": "rgba(0,0,0,0.50)",
    "shadesBlack45": "rgba(0,0,0,0.45)",
    "shadesBlack40": "rgba(0,0,0,0.40)",
    "shadesBlack30": "rgba(0,0,0,0.30)",
    "shadesBlack20": "rgba(0,0,0,0.20)",
    "shadesBlack10": "rgba(0,0,0,0.10)",
    "shadesBlack5": "rgba(0,0,0,0.05)",
    "shadesBlack0": "rgba(0,0,0,0.00)",
    "shadesMidnight90": "rgba(0,15,71,0.90)",
    "shadesMidnight85": "rgba(0,15,71,0.85)",
    "shadesMidnight80": "rgba(0,15,71,0.80)",
    "shadesMidnight75": "rgba(0,15,71,0.75)",
    "shadesMidnight70": "rgba(0,15,71,0.70)",
    "shadesMidnight65": "rgba(0,15,71,0.65)",
    "shadesMidnight60": "rgba(0,15,71,0.60)",
    "shadesMidnight55": "rgba(0,15,71,0.55)",
    "shadesMidnight50": "rgba(0,15,71,0.50)",
    "shadesMidnight45": "rgba(0,15,71,0.45)",
    "shadesMidnight40": "rgba(0,15,71,0.40)",
    "shadesMidnight30": "rgba(0,15,71,0.30)",
    "shadesMidnight20": "rgba(0,15,71,0.20)",
    "shadesMidnight10": "rgba(0,15,71,0.10)",
    "shadesActive90": "rgba(11,75,255,0.90)",
    "shadesActive85": "rgba(11,75,255,0.85)",
    "shadesActive80": "rgba(11,75,255,0.80)",
    "shadesActive75": "rgba(11,75,255,0.75)",
    "shadesActive70": "rgba(11,75,255,0.70)",
    "shadesActive65": "rgba(11,75,255,0.65)",
    "shadesActive60": "rgba(11,75,255,0.60)",
    "shadesActive55": "rgba(11,75,255,0.55)",
    "shadesActive50": "rgba(11,75,255,0.50)",
    "shadesActive45": "rgba(11,75,255,0.45)",
    "shadesActive40": "rgba(11,75,255,0.40)",
    "shadesActive30": "rgba(11,75,255,0.30)",
    "shadesActive20": "rgba(11,75,255,0.20)",
    "shadesActive10": "rgba(11,75,255,0.10)"
  },
  "spacing": [
    4,
    8,
    12,
    16,
    20,
    24,
    32,
    40,
    48,
    56,
    64,
    80,
    96,
    112,
    128
  ],
  "shadows": [
    {
      "level": 0,
      "value": "none",
      "usage": "Flat surfaces, nested containers"
    },
    {
      "level": 1,
      "value": "0 1px 2px rgba(0,0,0,0.08)",
      "usage": "Subtle separation, cards on flat bg"
    },
    {
      "level": 2,
      "value": "0 2px 4px rgba(0,0,0,0.10)",
      "usage": "Lifted cards, small pop surfaces"
    },
    {
      "level": 3,
      "value": "0 4px 8px rgba(0,0,0,0.12)",
      "usage": "Menus, popovers, sticky bars"
    },
    {
      "level": 4,
      "value": "0 8px 16px rgba(0,0,0,0.16)",
      "usage": "Dialogs, modal surfaces"
    },
    {
      "level": 5,
      "value": "0 12px 24px rgba(0,0,0,0.20)",
      "usage": "Highest elevation overlays (rare)"
    }
  ],
  "semantic": {
    "color": {
      "brandPrimary": "#000f47",
      "brandPrimaryDark": "#002c77",
      "brandSecondary": "#ceecff",
      "brandAccent": "#ffbf00",
      "textPrimary": "#000f47",
      "textPrimaryMode": "#002c77",
      "textSecondary": "#595959",
      "textTertiary": "#767676",
      "textOnAccent": "#ffffff",
      "textOnInteractive": "#ffffff",
      "textOnHero": "#ceecff",
      "textDisabled": "#767676",
      "textOnLight": "#000f47",
      "textOnDark": "#ffffff",
      "surfaceDefault": "#ffffff",
      "surfaceSubtle": "#f8f8f8",
      "surfaceMuted": "#e3e3e3",
      "surfaceAccent": "#f7f8f8",
      "surfaceSecondaryHover": "#ebf7ff",
      "surfaceSelected": "#ceecff",
      "surfaceNavigation": "#000f47",
      "surfaceNavigationMode": "#002c77",
      "surfaceNavigationHover": "#1a2759",
      "surfaceNavigationActive": "#333f6b",
      "surfaceAccentStrong": "#cfd0cd",
      "surfaceHero": "#000f47",
      "surfaceDisabled": "#e3e3e3",
      "borderSubtle": "#dadada",
      "borderDefault": "#878787",
      "borderStrong": "#595959",
      "borderFocus": "#3d7aff",
      "borderFocusMode": "#009de0",
      "focusRing": "#3d7aff",
      "interactivePrimary": "#000f47",
      "interactivePrimaryHover": "#06206e",
      "interactivePrimaryActive": "#082d9e",
      "interactivePrimaryDisabled": "#dadada",
      "interactiveAccentHover": "#eaa501",
      "interactiveAccentActive": "#d58b02",
      "interactiveSecondary": "#0b4bff",
      "interactiveSecondaryHover": "#082d9e",
      "interactiveSecondaryActive": "#06206e",
      "interactiveSecondaryVisited": "#8f20de",
      "interactiveTertiary": "#878787",
      "interactiveTertiaryHover": "#767676",
      "interactiveTertiaryActive": "#595959",
      "statusSuccess": "#14853d",
      "statusSuccessBg": "#f8fcf7",
      "statusSuccessBorder": "#14853d",
      "statusSuccessText": "#2f7d32",
      "statusWarning": "#cb7e03",
      "statusWarningBg": "#fffcf8",
      "statusWarningBorder": "#cb7e03",
      "statusWarningText": "#cb7623",
      "statusDanger": "#c53532",
      "statusDangerBg": "#fffafa",
      "statusDangerBorder": "#c53532",
      "statusDangerText": "#8b1a1a",
      "statusInfo": "#82baff",
      "statusInfoBg": "#f5fbff",
      "statusInfoBorder": "#82baff",
      "statusInfoText": "#000f47",
      "interactiveDanger": "#d33330",
      "interactiveDangerHover": "#af2625",
      "interactiveDangerActive": "#8b1a1a",
      "textOnDanger": "#ffffff"
    },